[
  {
    "case_id": "business-eft-transaction-confirmation",
    "question": "고객이 결제내역 확인을 요청하면 어떤 법적 의무와 절차를 확인해야 하나요?",
    "category": "multi_requirement",
    "difficulty": "easy",
    "domain": "electronic_finance",
    "top_k": 5,
    "expected_law_id": "010199",
    "expected_article_nos": ["제7조"],
    "expected_answer_points": ["이용자가 전자금융거래 내용을 확인할 수 있도록 거래내용을 제공한다.", "거래내용 제공 방법은 전자적 장치 등 법정 방식을 확인한다."],
    "expected_abstain": false,
    "annotation_note": "거래기록 보존과 이용자의 거래내용 확인 수단을 구별한다."
  },
  {
    "case_id": "business-eft-error-correction",
    "question": "고객이 결제 오류 정정을 요구한 경우 회사가 따라야 할 조사와 통지 절차는 무엇인가요?",
    "category": "similar_provision_disambiguation",
    "difficulty": "medium",
    "domain": "electronic_finance",
    "top_k": 5,
    "expected_law_id": "010199",
    "expected_article_nos": ["제8조"],
    "expected_answer_points": ["이용자는 거래내용의 오류 정정을 요구할 수 있다.", "회사는 오류를 조사하고 처리 결과를 이용자에게 알려야 한다."],
    "expected_abstain": false,
    "annotation_note": "전자금융사고 손해배상책임과 오류 정정 절차를 구별한다."
  },
  {
    "case_id": "business-eft-terms-disclosure",
    "question": "결제서비스 계약을 체결할 때 약관 설명과 사본 교부, 약관 변경 알림은 어떻게 해야 하나요?",
    "category": "multi_requirement",
    "difficulty": "hard",
    "domain": "electronic_finance",
    "top_k": 5,
    "expected_law_id": "010199",
    "expected_article_nos": ["제24조"],
    "expected_answer_points": ["계약 체결 시 약관을 명시하고 요청에 따라 사본을 교부·설명한다.", "약관 변경 시 시행 전 게시·통지 절차를 확인한다."],
    "expected_abstain": false,
    "annotation_note": "일반 계약책임과 전자금융거래법상 약관 절차를 구별한다."
  },
  {
    "case_id": "business-eft-dispute-handling",
    "question": "부정결제 민원이 접수되면 회사의 분쟁처리 절차와 외부 분쟁조정은 어떤 조문으로 검토하나요?",
    "category": "similar_provision_disambiguation",
    "difficulty": "medium",
    "domain": "electronic_finance",
    "top_k": 5,
    "expected_law_id": "010199",
    "expected_article_nos": ["제27조"],
    "expected_answer_points": ["이용자의 이의제기와 손해배상 요구를 처리하는 절차를 마련한다.", "금융감독원 또는 소비자분쟁조정위원회 등을 통한 분쟁조정 가능성을 확인한다."],
    "expected_abstain": false,
    "annotation_note": "사고 책임의 실체 판단과 민원·분쟁 처리절차를 구별한다."
  },
  {
    "case_id": "business-eft-accident-liability",
    "question": "해킹이나 접근매체 위조로 부정결제 사고가 발생했을 때 회사의 손해배상책임은 어떤 조문으로 검토하나요?",
    "category": "direct_statute_retrieval",
    "difficulty": "medium",
    "domain": "electronic_finance",
    "top_k": 5,
    "expected_law_id": "010199",
    "expected_article_nos": ["제9조"],
    "expected_answer_points": ["접근매체 위조·변조 등 법정 사고 유형에 대한 책임 원칙을 확인한다.", "이용자의 고의·중대한 과실 등 예외 가능성을 구분한다."],
    "expected_abstain": false,
    "annotation_note": "오류 정정이 아닌 전자금융사고 손해배상책임의 근거를 선택한다."
  },
  {
    "case_id": "business-eft-record-retention",
    "question": "결제사업자가 거래기록을 생성·보존하고 기간 경과 후 파기할 때 확인할 조문은 무엇인가요?",
    "category": "multi_requirement",
    "difficulty": "medium",
    "domain": "electronic_finance",
    "top_k": 5,
    "expected_law_id": "010199",
    "expected_article_nos": ["제22조"],
    "expected_answer_points": ["전자금융거래 내용을 추적·검색할 수 있는 기록을 생성·보존한다.", "보존기간 경과와 거래관계 종료 후 파기 기준 및 예외를 확인한다."],
    "expected_abstain": false,
    "annotation_note": "개인정보 파기와 전자금융거래기록 보존·파기를 구별한다."
  },
  {
    "case_id": "business-pipa-processing-delegation",
    "question": "결제 고객정보 처리업무를 콜센터 외주업체에 맡기려면 계약과 관리·감독 측면에서 무엇을 확인해야 하나요?",
    "category": "similar_provision_disambiguation",
    "difficulty": "hard",
    "domain": "digital_business",
    "top_k": 5,
    "expected_law_id": "011357",
    "expected_article_nos": ["제26조"],
    "expected_answer_points": ["처리위탁의 목적·범위 등 법정 사항을 문서에 포함한다.", "수탁자 공개와 교육·감독 의무를 확인한다."],
    "expected_abstain": false,
    "annotation_note": "외주업체가 등장하더라도 제3자 제공으로 단정하지 않고 처리위탁을 선택한다."
  },
  {
    "case_id": "business-pipa-breach-notice",
    "question": "결제서비스에서 고객 개인정보가 유출되면 정보주체 통지와 기관 신고는 어떤 조문으로 검토하나요?",
    "category": "multi_requirement",
    "difficulty": "medium",
    "domain": "digital_business",
    "top_k": 5,
    "expected_law_id": "011357",
    "expected_article_nos": ["제34조"],
    "expected_answer_points": ["유출 사실과 항목 등 법정 사항을 정보주체에게 통지한다.", "일정 규모 이상 등 요건에 따라 관계기관 신고를 검토한다."],
    "expected_abstain": false,
    "annotation_note": "전자금융사고 책임과 별도로 개인정보 유출 통지·신고 근거를 선택한다."
  },
  {
    "case_id": "business-ip-patent-novelty",
    "question": "신규 결제기술을 특허출원 전에 GitHub에 공개하면 신규성에 어떤 문제가 생길 수 있나요?",
    "category": "lay_to_legal_mapping",
    "difficulty": "medium",
    "domain": "intellectual_property",
    "top_k": 5,
    "expected_law_id": "001455",
    "expected_article_nos": ["제29조", "제30조"],
    "expected_answer_points": ["출원 전 공지·공연 실시·간행물 또는 전기통신회선 공개는 신규성 판단에 영향을 준다.", "공개 시점과 실제 공개 내용을 확인해야 한다.", "권리자 공개 등에 관한 공지예외의 기간과 절차 요건을 별도로 검토한다."],
    "expected_abstain": false,
    "annotation_note": "구체적인 특허 가능성을 단정하지 않고 신규성 원칙과 공지예외를 함께 찾는다."
  },
  {
    "case_id": "business-ip-disclosure-exception",
    "question": "발명자가 직접 기술을 공개한 뒤 12개월 안에 특허출원하면 공지예외를 적용받을 수 있나요?",
    "category": "multi_requirement",
    "difficulty": "hard",
    "domain": "intellectual_property",
    "top_k": 5,
    "expected_law_id": "001455",
    "expected_article_nos": ["제30조"],
    "expected_answer_points": ["권리자의 공개 등이 있은 날부터 12개월 이내 출원 요건을 확인한다.", "공지예외 주장과 증명서류 제출 등 절차 요건을 별도로 확인한다."],
    "expected_abstain": false,
    "annotation_note": "기간만으로 적용을 확정하지 않고 공개 주체·유형·절차를 함께 검토한다."
  },
  {
    "case_id": "business-ip-employee-invention",
    "question": "직원이 회사 업무 중 결제기술을 개발했다면 직무발명에 해당하는지 무엇을 기준으로 판단하나요?",
    "category": "multi_requirement",
    "difficulty": "hard",
    "domain": "intellectual_property",
    "top_k": 5,
    "expected_law_id": "000312",
    "expected_article_nos": ["제2조"],
    "expected_answer_points": ["발명이 사용자 등의 업무 범위에 속하는지 확인한다.", "발명을 하게 된 행위가 종업원의 현재 또는 과거 직무에 속하는지 확인한다."],
    "expected_abstain": false,
    "annotation_note": "직무발명 정의와 권리 승계·보상 문제를 구별한다."
  },
  {
    "case_id": "business-ip-work-made-for-hire",
    "question": "회사 기획 아래 직원이 업무로 작성한 결제 프로그램의 저작자는 누구인지 어떤 조문으로 검토하나요?",
    "category": "similar_provision_disambiguation",
    "difficulty": "hard",
    "domain": "intellectual_property",
    "top_k": 5,
    "expected_law_id": "000798",
    "expected_article_nos": ["제9조"],
    "expected_answer_points": ["법인 등의 기획과 업무 종사자의 업무상 작성 여부를 확인한다.", "컴퓨터프로그램은 법인 명의 공표 요건이 필요하지 않으며 계약·근무규칙의 다른 정함을 확인한다."],
    "expected_abstain": false,
    "annotation_note": "직원 업무상저작물과 외주개발물의 권리귀속을 동일하게 단정하지 않는다."
  }
]
